Nome;Gestor;Monthly Net Captation;Quarterly Net Captation;Yearly Net Captation;Monthly return;Spread Bench monthly return;Quarterly return;Spread Bench quarterly return;Yearly return;Spread Bench annual return;PL;Cota;Vol EWMA 97%;Sharpe ratio;Tracking error;VaR;Date
Af Invest FI RF Cred Priv Geraes;Af Invest Administracao de Recursos;-66 336 114;-230 774 960;-2 236 042 208;0,19;0,03;1,08;0,56;-0,57;-4,11;1 324 248 848;3,0412531;0,70;0,52;26,08;0,03;2020-09-30
ARX Denali Fc FI RF Cred Priv;ARX Investimentos Ltda;42 662 470;255 273 732;-392 977 961;0,12;-0,04;1,34;0,83;1,58;-1,96;1 479 894 989;1,09728917;0,64;2,14;26,06;0,04;2020-09-30
Az Quest Luce Fc FI RF Cred Priv LP;Az Quest Investimentos;-83 471 445;104 030 370;-3 830 360 948;0,44;0,28;2,77;2,26;-0,11;-3,65;2 364 934 903;1,43393394;1,27;4,28;25,96;0,08;2020-09-30
BNP Paribas Targus Fc FI RF Cred Priv;BNP Paribas Asset;-2 164 820;-29 086 325;-768 187 015;0,12;-0,04;0,98;0,47;2,14;-1,40;499 323 021;460,3050498;0,48;1,07;26,27;0,05;2020-09-30
Bnpp Rubi Fc FI RF Cred Priv;BNP Paribas Asset;-74 809 150;-179 662 152;-1 306 118 144;0,13;-0,03;1,25;0,74;0,68;-2,86;767 765 253;164,1033846;1,04;0,77;25,64;0,11;2020-09-30
Brad H FI RF Cred Priv LP Perf Instituc;Bram Bradesco Asset Management SA Dtvm;-6 525 513;-70 972 363;-2 363 671 783;0,31;0,15;1,16;0,65;2,46;-1,08;1 956 103 739;2,8378553;0,52;3,24;25,92;0,05;2020-09-30
Bradesco H FI RF Ref DI LP;Bram Bradesco Asset Management SA Dtvm;-16 066 860;-22 410 928;-170 460 381;-0,08;-0,24;0,24;-0,27;3,08;-0,47;515 359 621;30,4621703;0,22;-9,53;26,16;0,02;2020-09-30
Bp Cred Corp II Fc FI RF Cred Priv LP;Brasil Plural Gestao de Recursos Ltda;-4 909 253;-29 109 240;-363 684 831;0,49;0,33;2,36;1,85;-1,37;-4,91;203 621 450;1,84882659;1,04;4,22;26,16;0,04;2020-09-30
Btgp Access Balanceado FICFI Mult;BTG Pactual Wm Gestao de Recursos Ltda;1 402 773;8 132 269;108 732 808;-1,75;-1,91;1,26;0,75;1,56;-1,98;237 806 233;5,7821102;7,37;-0,89;19,41;0,74;2020-09-30
BTG Pact Cre Cor I FICFI RF Cred Priv;BTG Pactual;329 223 270;202 849 726;-922 940 686;0,53;0,38;2,98;2,47;-1,07;-4,61;1 023 510 205;2,2204486;1,01;5,05;26,24;0,04;2020-09-30
BTG Pactual Yield DI FI Ref Cred Priv;BTG Pactual;146 744 039;127 298 533;-2 920 494 526;0,27;0,12;0,87;0,36;-1,91;-5,45;1 518 644 417;31,1886085;0,84;0,37;26,26;0,03;2020-09-30
Ca In Avant Garde Feed1 Fc Mult Credpriv;Ca Indosuez Wealth (Brazil) S.A. Dtvm;-50 057;-2 462 914;-23 203 094;0,17;0,01;0,97;0,45;3,95;0,41;60 833 620;12,0257455;0,23;4,16;26,10;0,02;2020-09-30
Ca Indosuez Agilite FI RF Cred Priv;Ca Indosuez Wealth (Brazil) S.A. Dtvm;-29 137 391;-88 707 030;-1 240 051 101;0,00;-0,16;0,92;0,41;-2,71;-6,25;414 405 018;13,8721067;1,34;-0,48;25,57;0,12;2020-09-30
Ca Indosuez Beton FICFI Mult;Ca Indosuez Wealth (Brazil) S.A. Dtvm;-2 962 644;-3 284 480;73 513 305;-1,84;-2,00;1,77;1,26;3,92;0,38;190 921 189;74,682441;6,84;-0,71;19,90;0,63;2020-09-30
Ca Indosuez DI Master FI RF Ref DI LP;Ca Indosuez Wealth (Brazil) S.A. Dtvm;-32 866 234;-31 819 355;-809 310 601;-0,03;-0,19;0,48;-0,03;-0,46;-4,00;454 517 700;142,234376;0,67;-2,16;26,30;0,06;2020-09-30
Ca Indosuez Grand Vitesse Firf Cred Priv;Ca Indosuez Wealth (Brazil) S.A. Dtvm;-4 110 727;-9 960 343;-198 832 243;0,05;-0,10;1,50;0,99;-2,03;-5,57;191 999 961;10,5554093;1,20;0,61;25,73;0,10;2020-09-30
Ca Indosuez Private Pi Fc de FI Mult;Ca Indosuez Wealth (Brazil) S.A. Dtvm;-262 948;45 199;2 140 041;-2,61;-2,77;1,60;1,09;7,10;3,56;7 358 238;11,25992787;7,01;-1,13;28,52;0,68;2020-09-30
Ca Indosuez Vitesse FI RF Cred Priv;Ca Indosuez Wealth (Brazil) S.A. Dtvm;-46 483 041;-188 507 589;-2 336 410 631;0,06;-0,09;1,91;1,40;-2,24;-5,78;1 088 046 553;22,289856;1,33;1,09;25,64;0,11;2020-09-30
FICFI Caixa Rubi RF Ref DI LP;Caixa;-131 505 361;-185 969 482;-3 314 326 833;0,01;-0,15;0,42;-0,10;2,78;-0,77;8 842 769 850;2,642785;0,27;-3,57;26,09;0,03;2020-09-30
CSHG Top 30 Fc FI Mult;Credit Suisse Hedging Griffo Wm S.A.;-56 455 481;-115 004 267;-300 993 562;-1,74;-1,90;1,07;0,56;1,37;-2,17;1 599 750 076;6,5001308;5,94;-1,04;20,87;0,55;2020-09-30
Daycoval Classic Firf Cred. Priv.;Daycoval Asset Management Adm Rec Ltda;38 562 402;27 903 320;-607 987 295;0,17;0,02;1,23;0,72;1,69;-1,85;850 870 052;2,89821409;0,66;1,59;25,85;0,06;2020-09-30
Devant Magna FI RF Cred Priv LP;Devant Asset Investimentos Ltda;-738 892;-1 134 277;-4 954 465;0,82;0,66;4,12;3,61;1,31;-2,24;8 484 035;1,07069731;2,38;4,77;26,28;0,19;2020-09-30
G5 Allocation FICFI Mult;G5 Administradora de Recursos Ltda;26 997 932;88 508 111;126 362 718;-1,02;-1,17;1,62;1,10;7,99;4,45;231 177 797;8,2970106;3,21;-0,40;23,66;0,29;2020-09-30
Gama Top FICFI RF Cred Priv LP;Gama Investimentos Ltda;-16 948 697;-41 934 906;-122 140 482;0,42;0,26;3,21;2,70;-0,43;-3,97;218 858 967;1,09813598;1,70;3,36;26,36;0,12;2020-09-30
Itau Fof Orion Mult Cred Priv Ie FICFI;Itau Dtvm;-25 952 822;-149 801 681;-108 919 401;-1,85;-2,01;1,63;1,12;0,14;-3,40;2 754 649 495;17,061129;6,68;-0,86;20,66;0,65;2020-09-30
Itau Mult Hedge Fund 30 Mult FICFI;Itau Dtvm;-37 621 021;-60 678 735;454 590 480;-2,37;-2,52;0,47;-0,04;1,45;-2,10;6 666 945 121;46,597225;6,66;-1,46;20,54;0,66;2020-09-30
Itau Selecao Multifundos Mult Fc FI;Itau Dtvm;199 136 905;883 706 824;1 295 733 386;-0,98;-1,14;0,72;0,21;6,34;2,80;8 651 025 669;36,850975;2,56;-1,20;24,12;0,24;2020-09-30
Itau Selecao Multifundos Plus Mult Fc;Itau Dtvm;-57 906 172;-162 570 434;-17 719 114;-1,87;-2,03;1,35;0,84;2,50;-1,04;4 753 051 042;22,074263;6,46;-0,88;20,47;0,60;2020-09-30
Itau RF LP Cred Priv Diferenciado FI;Itau Unibanco SA;-214 824 578;-474 412 263;-12 501 830 993;0,26;0,11;0,85;0,34;2,97;-0,57;11 893 806 035;25,367277;0,83;1,51;26,33;0,10;2020-09-30
Jgp Corporate FICFI RF Cred Priv LP;Jgp Gestao de Credito Ltda;-3 935 781;-21 973 971;-95 618 344;0,88;0,73;3,50;2,99;1,26;-2,28;218 567 083;171,82034127;1,49;6,12;26,22;0,12;2020-09-30
Opportunity Allocation Fc FI Mult;Opp Gestora de Recursos Ltda;1 681 626;1 855 149;-14 685 803;-1,70;-1,85;3,12;2,60;5,39;1,85;64 050 622;6,35525502;9,35;-0,08;17,79;0,80;2020-09-30
Ouro Preto FICFI Mult Cred Priv;Ouro Preto Investimentos;-2 363 383;-15 437 437;-60 318 794;0,37;0,22;1,16;0,65;5,38;1,83;110 644 089;2,59801265;0,04;51,15;26,18;0,00;2020-09-30
Safra Exec Fc FI RF;Safra Asset Management Ltda;-58 244 094;-139 425;-1 176 566 555;-0,05;-0,21;0,40;-0,12;3,62;0,08;6 598 457 281;7864,786171;0,72;-1,66;25,71;0,06;2020-09-30
Cart Sam Private Pi Mult Cred Priv FI;Santander Brasil Gestao de Recursos Ltda;-567;-245 307;-345 344;-1,67;-1,82;0,00;-0,51;-2,05;-5,59;1 276 386;101,5829135;6,56;-1,39;20,45;0,64;2020-09-30
Santander Alocacao Mult Fc FI;Santander Brasil Gestao de Recursos Ltda;-52 177 342;-113 300 718;-446 486 845;-1,57;-1,73;1,04;0,53;2,65;-0,90;2 711 980 669;358,8719775;5,17;-1,06;21,49;0,49;2020-09-30
Santander Fc FI Institucional RF Ref DI;Santander Brasil Gestao de Recursos Ltda;-22 359 701;-166 236 402;-2 823 069 754;0,04;-0,11;0,56;0,04;2,58;-0,96;1 693 031 077;185,7340674;0,25;-2,44;26,19;0,02;2020-09-30
Santander FI Master RF Cred Priv LP;Santander Brasil Gestao de Recursos Ltda;22 633 684;27 020 109;-1 860 934 983;0,16;-0,00;1,00;0,49;2,17;-1,37;2 119 972 878;24,1600033;0,49;1,11;26,07;0,04;2020-09-30
Solis Cap Ant Cred Priv FICFI Mult LP;Solis Investimentos;-1 180 225;-6 411 177;-818 194 960;0,22;0,07;0,84;0,32;4,76;1,22;35 381 121;2,4101244;0,11;15,66;26,17;0,01;2020-09-30
Sparta Top FICFI RF Cred Priv LP;Sparta;-29 822 419;-40 885 930;-1 576 420 617;0,38;0,22;2,64;2,13;1,31;-2,23;1 251 504 087;2,191742;0,89;5,88;26,12;0,05;2020-09-30
Valora Guardian Fc FI Mult Cred Priv;Valora Gestao de Investimentos Ltda;-4 210 414;-18 211 258;-75 538 807;0,27;0,11;0,92;0,41;4,70;1,16;122 312 846;3,06848058;0,17;9,16;26,18;0,01;2020-09-30
Vitreo Fof M F Fc de FI Mult Cred Priv;Vitreo Gestao de Recursos Ltda;3 234 077;32 761 735;144 457 832;-1,73;-1,89;2,12;1,61;7,05;3,51;685 667 990;1,13103646;6,56;-0,40;20,49;0,64;2020-09-30
Xp Investor FI RF Cred Priv LP;Xp Vista Asset Management Ltda;-41 654 937;-105 230 801;-1 309 491 753;0,31;0,16;1,69;1,18;0,61;-2,93;809 096 134;2,7003822;0,89;2,73;25,97;0,06;2020-09-30
Xp Top Cred Priv RF FI LP;Xp Vista Asset Management Ltda;-51 956 150;-65 074 301;-955 551 284;0,32;0,17;2,12;1,61;1,17;-2,37;779 279 305;11861,302449;0,83;3,91;26,00;0,06;2020-09-30